codigo_uc;nome_uc;categoria_manejo;grupo;ano_inicial;ano_final;area_inicial;area_final;delta_area;delta_pct;slope_ha_ano;slope_pct_ano;n_anos;span_anos;coverage_ratio;max_abs_yoy_pct;median_abs_yoy_pct;coorte;serie_tipo;qc_area_suspeita;qc_salto_excessivo;qc_yoy_excessivo;qc_cobertura_baixa;qc_pass;tendencia
1125;RESERVA PARTICULAR DO PATRIMÔNIO NATURAL FARROUPILHA;Reserva Particular do Patrimônio Natural;US;2019;2024;10.0;7.0866416480000005;-2.9133583519999995;-0.29133583519999995;-0.8122563946857142;-0.08996202688113854;6;6;1.0;0.5309150962955899;0.0;nova;longa;False;False;False;False;True;reduziu
951;ÁREA DE PROTEÇÃO AMBIENTAL DO ESTUÁRIO DO RIO CEARÁ - RIO MARANGUAPINHO;Área de Proteção Ambiental;US;2019;2024;3447.0;2737.094125;-709.9058749999999;-0.20594890484479256;-182.54991428571427;-0.0590388298649506;6;6;1.0;0.2059762111981433;0.0;nova;longa;False;False;False;False;True;reduziu
1790;PARQUE NATURAL MUNICIPAL CHICO MENDES;Parque;PI;2019;2024;47.5;40.65477827;-6.845221729999999;-0.14410993115789472;-1.9360506811428568;-0.0449704774475052;6;6;1.0;0.24074074074074073;0.0;nova;longa;False;False;False;False;True;reduziu
34;MONUMENTO NATURAL DAS ILHAS CAGARRAS;Monumento Natural;PI;2019;2024;106.0;91.19849516;-14.801504840000007;-0.13963683811320762;-3.383201106285716;-0.035217405674593694;6;6;1.0;0.14150943396226415;0.0;nova;longa;False;False;False;False;True;reduziu
17;ÁREA DE PROTEÇÃO AMBIENTAL DE GUARAQUEÇABA;Área de Proteção Ambiental;US;2019;2024;282441.0;245640.9079;-36800.09210000001;-0.13029302438385365;-8411.449622857144;-0.031133418466791535;6;6;1.0;0.13029302438385365;0.0;nova;longa;False;False;False;False;True;reduziu
2197;RESERVA PARTICULAR DO PATRIMÔNIO NATURAL RIO DO BRASIL II;Reserva Particular do Patrimônio Natural;US;2019;2024;401.0;355.15184254999997;-45.84815745000003;-0.11433455723192028;-13.074794974285716;-0.033897353381401436;6;6;1.0;0.22675934223511146;0.0;nova;longa;False;False;False;False;True;reduziu
3027;PARQUE NATURAL MUNICIPAL DA MATA ATLÂNTICA ALDEENSE;Parque;PI;2019;2024;268.0;244.71150340000003;-23.288496599999974;-0.08689737537313423;-6.661482211428569;-0.02559773558767023;6;6;1.0;0.17470369177806408;0.0;nova;longa;False;False;False;False;True;reduziu
3231;PARQUE NATURAL MUNICIPAL DA CAIXA D´ÁGUA;Parque;PI;2019;2024;18.0;16.63987917;-1.3601208299999996;-0.07556226833333331;-0.31088476114285707;-0.01771763723880469;6;6;1.0;0.07556226833333331;0.0;nova;longa;False;False;False;False;True;reduziu
10;ÁREA DE PROTEÇÃO AMBIENTAL DE PETRÓPOLIS;Área de Proteção Ambiental;US;2019;2024;68224.0;63457.72047;-4766.27953;-0.06986221168503752;-1361.8103531428571;-0.02043678915152243;6;6;1.0;0.1397321543993648;0.0;nova;longa;False;False;False;False;True;reduziu
2275;RESERVA PARTICULAR DO PATRIMÔNIO NATURAL GOTAS AZUIS;Reserva Particular do Patrimônio Natural;US;2019;2024;7.0;6.552654954;-0.4473450459999997;-0.0639064351428571;-0.10225029622857135;-0.01492512229550244;6;6;1.0;0.0639064351428571;0.0;nova;longa;False;False;False;False;True;reduziu
52;ESTAÇÃO ECOLÓGICA DE CARIJÓS;Estação Ecológica;PI;2019;2024;759.0;711.8933102000001;-47.10668979999991;-0.062064149934123736;-13.478715537142849;-0.01813366873942584;6;6;1.0;0.1249782921694021;0.0;nova;longa;False;False;False;False;True;reduziu
323;ÁREA DE PROTEÇÃO AMBIENTAL LITORAL NORTE;Área de Proteção Ambiental;US;2019;2024;144689.0;137183.9879;-7505.012099999993;-0.05186995625099346;-1715.4313371428555;-0.012280712937502694;6;6;1.0;0.05188369537421642;0.0;nova;longa;False;False;False;False;True;reduziu
3660;RPPN BRAVA BEACH INTERNACIONAL;Reserva Particular do Patrimônio Natural;US;2019;2024;6.0;5.694623663;-0.3053763370000002;-0.0508960561666667;-0.06980030560000006;-0.01183415487032165;6;6;1.0;0.0508960561666667;0.0;nova;longa;False;False;False;False;True;reduziu
1464;RESERVA PARTICULAR DO PATRIMÔNIO NATURAL FAZENDA ROSA DO SOL;Reserva Particular do Patrimônio Natural;US;2019;2024;16.0;15.21292685;-0.7870731499999994;-0.049192071874999965;-0.17990243428571415;-0.011431346007669558;6;6;1.0;0.049192071874999965;0.0;nova;longa;False;False;False;False;True;reduziu
2646;PARQUE NATURAL MUNICIPAL GRUTA DA ONÇA;Parque;PI;2019;2024;7.0;6.669320078;-0.33067992199999985;-0.04723998885714283;-0.07558398217142853;-0.010970459872825508;6;6;1.0;0.04723998885714283;0.0;nova;longa;False;False;False;False;True;reduziu
1094;RESERVA PARTICULAR DO PATRIMÔNIO NATURAL MORRO DA PALHA;Reserva Particular do Patrimônio Natural;US;2019;2024;7.0;6.674067455;-0.3259325449999997;-0.0465617921428571;-0.07449886742857136;-0.010810480461679138;6;6;1.0;0.0465617921428571;0.0;nova;longa;False;False;False;False;True;reduziu
1114;RESERVA PARTICULAR DO PATRIMÔNIO NATURAL SAPUCAIA;Reserva Particular do Patrimônio Natural;US;2019;2024;19.0;18.29264694;-0.7073530599999991;-0.037229108421052585;-0.16168069942857122;-0.008616437930209605;6;6;1.0;0.037229108421052585;0.0;nova;longa;False;False;False;False;True;reduziu
1179;RESERVA PARTICULAR DO PATRIMÔNIO NATURAL CEC/TINGUÁ;Reserva Particular do Patrimônio Natural;US;2019;2024;17.0;16.38784707;-0.6121529300000006;-0.03600899588235298;-0.13992066971428585;-0.008330620051293602;6;6;1.0;0.03600899588235298;0.0;nova;longa;False;False;False;False;True;reduziu
2359;PARQUE NATURAL MUNICIPAL DE NAVEGANTES;Parque;PI;2019;2024;14.0;13.51055721;-0.48944279;-0.03496019928571429;-0.11187263771428572;-0.008085121850930152;6;6;1.0;0.03496019928571429;0.0;nova;longa;False;False;False;False;True;reduziu
3626;PARQUE NATURAL MUNICIPAL DA LAGOA DO PEREQUÊ;Parque;PI;2019;2024;9.0;8.689614794;-0.3103852059999994;-0.034487245111111044;-0.070945189942857;-0.00797447139913079;6;6;1.0;0.034487245111111044;0.0;nova;longa;False;False;False;False;True;reduziu
1783;APA DA FAZENDA DA TAQUARA;Área de Proteção Ambiental;US;2019;2024;9.0;8.695434327;-0.3045656730000008;-0.03384063033333343;-0.06961501097142876;-0.00782324911279149;6;6;1.0;0.03384063033333343;0.0;nova;longa;False;False;False;False;True;reduziu
3664;RPPN FAZENDA DAS ÁGUAS E DAS MATAS;Reserva Particular do Patrimônio Natural;US;2019;2024;11.0;10.69914201;-0.3008579900000008;-0.027350726363636436;-0.06876754057142875;-0.006309114216244423;6;6;1.0;0.027350726363636436;0.0;nova;longa;False;False;False;False;True;reduziu
2740;RESERVA PARTICULAR DO PATRIMÔNIO NATURAL LAGOA ENCANTADA DO MORRO DA LUCRÉCIA;Reserva Particular do Patrimônio Natural;US;2019;2024;11.0;10.72113458;-0.2788654200000007;-0.025351401818181882;-0.06374066742857158;-0.0058439905810171566;6;6;1.0;0.025351401818181882;0.0;nova;longa;False;False;False;False;True;reduziu
3156;PARQUE NATURAL MUNICIPAL DE NITERÓI;Parque;PI;2020;2024;918.5;895.6661586;-22.833841399999983;-0.024859925313010324;-6.800152419999995;-0.007477078807588841;5;5;1.0;0.025390469423286162;0.0005446623093681918;nova;longa;False;False;False;False;True;reduziu
2152;RESERVA PARTICULAR DO PATRIMÔNIO NATURAL PERNA DO PIRATA;Reserva Particular do Patrimônio Natural;US;2019;2024;19.0;18.54583721;-0.4541627900000016;-0.023903304736842188;-0.10380863771428607;-0.005507494954691081;6;6;1.0;0.023903304736842188;0.0;nova;longa;False;False;False;False;True;reduziu
